{
  "schema_version": "3.0.0",
  "contract_id": "dosa-v3-u0",
  "window_profiles": [
    {"window_size": 16, "stride": 16},
    {"window_size": 100, "stride": 100},
    {"window_size": 500, "stride": 500},
    {"window_size": 1000, "stride": 1000}
  ],
  "k_min": 1,
  "k_max": 8,
  "operator_panel": {
    "positional": ["R", "RC"],
    "kmer_r": [2, 3, 4, 5, 6, 7, 8],
    "kmer_rc": [1, 2, 3, 4, 5, 6, 7, 8],
    "omitted_identically_zero": ["kmer_r_k1"]
  },
  "null_model": "euler_wilson_fixed_endpoints_v1",
  "null_replicates": 1000,
  "coordinate_system": "zero_based_half_open"
}
